{"experiment": 0, "commit": "b692d6a", "quantile_loss": 0.2684, "status": "KEEP", "description": "baseline: combined output projection, 1 epoch", "config": {"learning_rate": 0.003, "hidden_size": 64, "num_encoder_layers": 2, "num_decoder_layers": 2, "dropout_rate": 0.1, "batch_size": 256, "input_length": 35, "output_length": 7, "epoch_count": 1, "validation_split": 0.8}, "changes": "combined temporal_projection + output_layer into single output_projection Linear(64, 21) to fix tinygrad CPU codegen assertion on 3D tensor backward pass", "reasoning": "tinygrad 0.12.0 CPU backend crashes when Linear is applied to 3D tensors during backward. merging the two projection layers into one 2D linear avoids the bug while preserving model expressiveness"}
{"experiment": 1, "commit": "e4d2b8c", "quantile_loss": 0.2541, "status": "KEEP", "description": "add relu before output projection", "config": {"learning_rate": 0.003, "hidden_size": 64, "num_encoder_layers": 2, "num_decoder_layers": 2, "dropout_rate": 0.1, "batch_size": 256, "input_length": 35, "output_length": 7, "epoch_count": 1, "validation_split": 0.8}, "changes": "added .relu() activation on the encoder+decoder skip connection output before feeding into output_projection", "reasoning": "the skip connection sum goes directly into a linear projection with no nonlinearity. adding relu gives the model a chance to learn more complex output mappings and prevents negative activations from dominating the projection"}
{"experiment": 2, "commit": "8eded76", "quantile_loss": 0.2785, "status": "DISCARD", "description": "increase hidden_size to 128", "config": {"learning_rate": 0.003, "hidden_size": 128, "num_encoder_layers": 2, "num_decoder_layers": 2, "dropout_rate": 0.1, "batch_size": 256, "input_length": 35, "output_length": 7, "epoch_count": 1, "validation_split": 0.8}, "changes": "changed hidden_size from 64 to 128 in DEFAULT_CONFIGURATION", "reasoning": "500 input features compressed to 64 hidden units may be too aggressive. doubling capacity could allow richer representations. result: worse loss, likely overfitting with only 1 epoch on small synthetic dataset"}
{"experiment": 3, "commit": "452f220", "quantile_loss": 0.3559, "status": "DISCARD", "description": "lower learning rate to 0.001", "config": {"learning_rate": 0.001, "hidden_size": 64, "num_encoder_layers": 2, "num_decoder_layers": 2, "dropout_rate": 0.1, "batch_size": 256, "input_length": 35, "output_length": 7, "epoch_count": 1, "validation_split": 0.8}, "changes": "changed learning_rate from 0.003 to 0.001 in DEFAULT_CONFIGURATION", "reasoning": "with 1 epoch, 0.003 might overshoot. result: significantly worse - with only 1 pass through data, higher LR makes more progress. 0.003 is better for single-epoch training"}
{"experiment": 4, "commit": null, "quantile_loss": 0.2732, "status": "DISCARD", "description": "increase learning rate to 0.01", "config": {"learning_rate": 0.01, "hidden_size": 64, "num_encoder_layers": 2, "num_decoder_layers": 2, "dropout_rate": 0.1, "batch_size": 256, "input_length": 35, "output_length": 7, "epoch_count": 1, "validation_split": 0.8}, "changes": "learning_rate 0.003 -> 0.01 (config-only, parallel batch)", "reasoning": "since lower LR hurt, try higher. result: also worse than 0.003, suggesting 0.003 is near-optimal for single-epoch Adam on this model"}
{"experiment": 5, "commit": null, "quantile_loss": 0.2633, "status": "DISCARD", "description": "increase learning rate to 0.005", "config": {"learning_rate": 0.005, "hidden_size": 64, "num_encoder_layers": 2, "num_decoder_layers": 2, "dropout_rate": 0.1, "batch_size": 256, "input_length": 35, "output_length": 7, "epoch_count": 1, "validation_split": 0.8}, "changes": "learning_rate 0.003 -> 0.005 (config-only, parallel batch)", "reasoning": "midpoint between 0.003 and 0.01. result: worse than 0.003, confirming 0.003 is near-optimal"}
{"experiment": 6, "commit": null, "quantile_loss": 0.2640, "status": "DISCARD", "description": "disable dropout", "config": {"learning_rate": 0.003, "hidden_size": 64, "num_encoder_layers": 2, "num_decoder_layers": 2, "dropout_rate": 0.0, "batch_size": 256, "input_length": 35, "output_length": 7, "epoch_count": 1, "validation_split": 0.8}, "changes": "dropout_rate 0.1 -> 0.0 (config-only, parallel batch)", "reasoning": "with 1 epoch no overfitting risk, so dropout may just reduce effective capacity. result: slightly worse, dropout=0.1 is fine"}
{"experiment": 7, "commit": null, "quantile_loss": 0.2489, "status": "KEEP", "description": "increase encoder layers to 3", "config": {"learning_rate": 0.003, "hidden_size": 64, "num_encoder_layers": 3, "num_decoder_layers": 2, "dropout_rate": 0.1, "batch_size": 256, "input_length": 35, "output_length": 7, "epoch_count": 1, "validation_split": 0.8}, "changes": "num_encoder_layers 2 -> 3 (config-only, parallel batch)", "reasoning": "deeper encoder can capture more complex feature interactions. result: new best, suggesting model was under-capacity on the encoder side"}
{"experiment": 8, "commit": null, "quantile_loss": 0.2620, "status": "DISCARD", "description": "increase encoder layers to 4", "config": {"learning_rate": 0.003, "hidden_size": 64, "num_encoder_layers": 4, "num_decoder_layers": 2, "dropout_rate": 0.1, "batch_size": 256, "input_length": 35, "output_length": 7, "epoch_count": 1, "validation_split": 0.8}, "changes": "num_encoder_layers 3 -> 4 (config-only, parallel batch)", "reasoning": "4 encoder layers worse than 3, suggesting diminishing returns from encoder depth with 1 epoch"}
{"experiment": 9, "commit": null, "quantile_loss": 0.2619, "status": "DISCARD", "description": "increase decoder layers to 3", "config": {"learning_rate": 0.003, "hidden_size": 64, "num_encoder_layers": 3, "num_decoder_layers": 3, "dropout_rate": 0.1, "batch_size": 256, "input_length": 35, "output_length": 7, "epoch_count": 1, "validation_split": 0.8}, "changes": "num_decoder_layers 2 -> 3 (config-only, parallel batch)", "reasoning": "extra decoder layer did not help, decoder capacity at 2 is sufficient"}
{"experiment": 10, "commit": null, "quantile_loss": 0.2407, "status": "KEEP", "description": "reduce batch size to 128", "config": {"learning_rate": 0.003, "hidden_size": 64, "num_encoder_layers": 3, "num_decoder_layers": 2, "dropout_rate": 0.1, "batch_size": 128, "input_length": 35, "output_length": 7, "epoch_count": 1, "validation_split": 0.8}, "changes": "batch_size 256 -> 128 (config-only, parallel batch)", "reasoning": "smaller batch = more gradient updates per epoch. with only 1 epoch this is significant. new best, 3.3% improvement over 0.2489"}
{"experiment": 11, "commit": null, "quantile_loss": 0.2697, "status": "DISCARD", "description": "increase learning rate to 0.004", "config": {"learning_rate": 0.004, "hidden_size": 64, "num_encoder_layers": 3, "num_decoder_layers": 2, "dropout_rate": 0.1, "batch_size": 256, "input_length": 35, "output_length": 7, "epoch_count": 1, "validation_split": 0.8}, "changes": "learning_rate 0.003 -> 0.004 (config-only, parallel batch)", "reasoning": "higher LR overshoots, confirming 0.003 remains optimal"}
{"experiment": 12, "commit": null, "quantile_loss": 0.2155, "status": "KEEP", "description": "reduce batch size to 64", "config": {"learning_rate": 0.003, "hidden_size": 64, "num_encoder_layers": 3, "num_decoder_layers": 2, "dropout_rate": 0.1, "batch_size": 64, "input_length": 35, "output_length": 7, "epoch_count": 1, "validation_split": 0.8}, "changes": "batch_size 128 -> 64 (config-only, parallel batch)", "reasoning": "smaller batch = more gradient updates. with 1 epoch this is highly impactful. 10.5% improvement over 0.2407"}
{"experiment": 13, "commit": null, "quantile_loss": 0.2260, "status": "DISCARD", "description": "batch size 96", "config": {"learning_rate": 0.003, "hidden_size": 64, "num_encoder_layers": 3, "num_decoder_layers": 2, "dropout_rate": 0.1, "batch_size": 96, "input_length": 35, "output_length": 7, "epoch_count": 1, "validation_split": 0.8}, "changes": "batch_size 128 -> 96 (config-only, parallel batch)", "reasoning": "better than 128 but worse than 64, confirming smaller is better"}
{"experiment": 14, "commit": null, "quantile_loss": 0.2163, "status": "DISCARD", "description": "batch 128 + lr 0.002", "config": {"learning_rate": 0.002, "hidden_size": 64, "num_encoder_layers": 3, "num_decoder_layers": 2, "dropout_rate": 0.1, "batch_size": 128, "input_length": 35, "output_length": 7, "epoch_count": 1, "validation_split": 0.8}, "changes": "batch_size 128 + learning_rate 0.002 (config-only, parallel batch)", "reasoning": "lower LR with batch=128 is competitive but batch=64 at lr=0.003 is still better"}
{"experiment": 15, "commit": null, "quantile_loss": 0.2162, "status": "DISCARD", "description": "batch 128 + lr 0.005", "config": {"learning_rate": 0.005, "hidden_size": 64, "num_encoder_layers": 3, "num_decoder_layers": 2, "dropout_rate": 0.1, "batch_size": 128, "input_length": 35, "output_length": 7, "epoch_count": 1, "validation_split": 0.8}, "changes": "batch_size 128 + learning_rate 0.005 (config-only, parallel batch)", "reasoning": "higher LR with batch=128 nearly matches batch=64 at lr=0.003, but not quite"}
{"experiment": 16, "commit": null, "quantile_loss": 0.1975, "status": "KEEP", "description": "reduce batch size to 32", "config": {"learning_rate": 0.003, "hidden_size": 64, "num_encoder_layers": 3, "num_decoder_layers": 2, "dropout_rate": 0.1, "batch_size": 32, "input_length": 35, "output_length": 7, "epoch_count": 1, "validation_split": 0.8}, "changes": "batch_size 64 -> 32 (config-only, parallel batch)", "reasoning": "trend continues: halving batch size again gives 8.4% improvement. more gradient steps per epoch matters enormously with 1-epoch training"}
{"experiment": 17, "commit": null, "quantile_loss": 0.2038, "status": "DISCARD", "description": "batch size 48", "config": {"learning_rate": 0.003, "hidden_size": 64, "num_encoder_layers": 3, "num_decoder_layers": 2, "dropout_rate": 0.1, "batch_size": 48, "input_length": 35, "output_length": 7, "epoch_count": 1, "validation_split": 0.8}, "changes": "batch_size 64 -> 48 (config-only, parallel batch)", "reasoning": "better than 64 but worse than 32"}
{"experiment": 18, "commit": null, "quantile_loss": 0.2079, "status": "DISCARD", "description": "batch 64 + lr 0.002", "config": {"learning_rate": 0.002, "hidden_size": 64, "num_encoder_layers": 3, "num_decoder_layers": 2, "dropout_rate": 0.1, "batch_size": 64, "input_length": 35, "output_length": 7, "epoch_count": 1, "validation_split": 0.8}, "changes": "batch=64 + lr=0.002 (config-only, parallel batch)", "reasoning": "lower LR helps batch=64 but batch=32 at lr=0.003 is still better"}
{"experiment": 19, "commit": null, "quantile_loss": 0.2074, "status": "DISCARD", "description": "batch 64 + lr 0.005", "config": {"learning_rate": 0.005, "hidden_size": 64, "num_encoder_layers": 3, "num_decoder_layers": 2, "dropout_rate": 0.1, "batch_size": 64, "input_length": 35, "output_length": 7, "epoch_count": 1, "validation_split": 0.8}, "changes": "batch=64 + lr=0.005 (config-only, parallel batch)", "reasoning": "higher LR helps batch=64 but batch=32 at lr=0.003 is still better"}
{"experiment": 20, "commit": null, "quantile_loss": 0.1926, "status": "DISCARD", "description": "batch size 16", "config": {"learning_rate": 0.003, "hidden_size": 64, "num_encoder_layers": 3, "num_decoder_layers": 2, "dropout_rate": 0.1, "batch_size": 16, "input_length": 35, "output_length": 7, "epoch_count": 1, "validation_split": 0.8}, "changes": "batch_size 32 -> 16 (config-only, parallel batch)", "reasoning": "smaller batch helps but diminishing returns. also much slower training"}
{"experiment": 21, "commit": null, "quantile_loss": 0.1962, "status": "DISCARD", "description": "batch 32 + lr 0.002", "config": {"learning_rate": 0.002, "hidden_size": 64, "num_encoder_layers": 3, "num_decoder_layers": 2, "dropout_rate": 0.1, "batch_size": 32, "input_length": 35, "output_length": 7, "epoch_count": 1, "validation_split": 0.8}, "changes": "batch=32 + lr=0.002 (config-only, parallel batch)", "reasoning": "slightly better than baseline lr=0.003 at batch=32 but not best"}
{"experiment": 22, "commit": null, "quantile_loss": 0.1992, "status": "DISCARD", "description": "batch 32 + lr 0.005", "config": {"learning_rate": 0.005, "hidden_size": 64, "num_encoder_layers": 3, "num_decoder_layers": 2, "dropout_rate": 0.1, "batch_size": 32, "input_length": 35, "output_length": 7, "epoch_count": 1, "validation_split": 0.8}, "changes": "batch=32 + lr=0.005 (config-only, parallel batch)", "reasoning": "higher LR hurts at batch=32"}
{"experiment": 23, "commit": null, "quantile_loss": 0.1889, "status": "KEEP", "description": "disable dropout with batch 32", "config": {"learning_rate": 0.003, "hidden_size": 64, "num_encoder_layers": 3, "num_decoder_layers": 2, "dropout_rate": 0.0, "batch_size": 32, "input_length": 35, "output_length": 7, "epoch_count": 1, "validation_split": 0.8}, "changes": "dropout_rate 0.1 -> 0.0 (config-only, parallel batch)", "reasoning": "with 1 epoch no overfitting risk, dropout just reduces effective capacity. 4.4% improvement"}
{"experiment": 24, "commit": null, "quantile_loss": 0.1843, "status": "KEEP", "description": "batch 16 + dropout 0", "config": {"learning_rate": 0.003, "hidden_size": 64, "num_encoder_layers": 3, "num_decoder_layers": 2, "dropout_rate": 0.0, "batch_size": 16, "input_length": 35, "output_length": 7, "epoch_count": 1, "validation_split": 0.8}, "changes": "batch_size 32 -> 16 + dropout_rate 0.0 (config-only, parallel batch)", "reasoning": "combining the two winners: smaller batch for more gradient steps + no dropout for full capacity. 2.4% improvement"}
{"experiment": 25, "commit": null, "quantile_loss": 0.1857, "status": "DISCARD", "description": "batch 32 + dropout 0 + lr 0.002", "config": {"learning_rate": 0.002, "hidden_size": 64, "num_encoder_layers": 3, "num_decoder_layers": 2, "dropout_rate": 0.0, "batch_size": 32, "input_length": 35, "output_length": 7, "epoch_count": 1, "validation_split": 0.8}, "changes": "batch=32 + dropout=0 + lr=0.002 (config-only, parallel batch)", "reasoning": "lower LR with no dropout is competitive but batch=16 still better"}
{"experiment": 26, "commit": null, "quantile_loss": 0.1904, "status": "DISCARD", "description": "batch 32 + dropout 0 + lr 0.004", "config": {"learning_rate": 0.004, "hidden_size": 64, "num_encoder_layers": 3, "num_decoder_layers": 2, "dropout_rate": 0.0, "batch_size": 32, "input_length": 35, "output_length": 7, "epoch_count": 1, "validation_split": 0.8}, "changes": "batch=32 + dropout=0 + lr=0.004 (config-only, parallel batch)", "reasoning": "higher LR hurts even without dropout"}
{"experiment": 27, "commit": null, "quantile_loss": 0.1894, "status": "DISCARD", "description": "batch 32 + dropout 0 + hidden 48", "config": {"learning_rate": 0.003, "hidden_size": 48, "num_encoder_layers": 3, "num_decoder_layers": 2, "dropout_rate": 0.0, "batch_size": 32, "input_length": 35, "output_length": 7, "epoch_count": 1, "validation_split": 0.8}, "changes": "batch=32 + dropout=0 + hidden=48 (config-only, parallel batch)", "reasoning": "smaller hidden barely affects results, hidden=64 is fine"}
{"experiment": 28, "commit": "e9100aa", "quantile_loss": 0.1840, "status": "KEEP", "description": "two-stage feature projection", "config": {"learning_rate": 0.003, "hidden_size": 64, "num_encoder_layers": 3, "num_decoder_layers": 2, "dropout_rate": 0.0, "batch_size": 16, "input_length": 35, "output_length": 7, "epoch_count": 1, "validation_split": 0.8}, "changes": "replaced single feature_projection Linear(input, hidden) with two-stage: Linear(input, 2*hidden) -> relu -> Linear(2*hidden, hidden) -> relu", "reasoning": "gentler compression from ~500 features through intermediate 128-dim space. marginal improvement, suggesting the model was already compressing well"}
{"experiment": 29, "commit": null, "quantile_loss": 0.1765, "status": "DISCARD", "description": "2 epochs", "config": {"learning_rate": 0.003, "hidden_size": 64, "num_encoder_layers": 3, "num_decoder_layers": 2, "dropout_rate": 0.0, "batch_size": 16, "input_length": 35, "output_length": 7, "epoch_count": 2, "validation_split": 0.8}, "changes": "epoch_count 1 -> 2", "reasoning": "more training helps, loss drops from 0.1840 to 0.1765"}
{"experiment": 30, "commit": null, "quantile_loss": 0.1761, "status": "DISCARD", "description": "3 epochs", "config": {"learning_rate": 0.003, "hidden_size": 64, "num_encoder_layers": 3, "num_decoder_layers": 2, "dropout_rate": 0.0, "batch_size": 16, "input_length": 35, "output_length": 7, "epoch_count": 3, "validation_split": 0.8}, "changes": "epoch_count 1 -> 3", "reasoning": "diminishing returns starting, marginal improvement over 2 epochs"}
{"experiment": 31, "commit": null, "quantile_loss": 0.1740, "status": "KEEP", "description": "5 epochs", "config": {"learning_rate": 0.003, "hidden_size": 64, "num_encoder_layers": 3, "num_decoder_layers": 2, "dropout_rate": 0.0, "batch_size": 16, "input_length": 35, "output_length": 7, "epoch_count": 5, "validation_split": 0.8}, "changes": "epoch_count 1 -> 5", "reasoning": "best final loss at 5 epochs, still showing improvement curve. new best at 0.1740"}
{"experiment": 32, "commit": null, "quantile_loss": 0.1752, "status": "DISCARD", "description": "10 epochs", "config": {"learning_rate": 0.003, "hidden_size": 64, "num_encoder_layers": 3, "num_decoder_layers": 2, "dropout_rate": 0.0, "batch_size": 16, "input_length": 35, "output_length": 7, "epoch_count": 10, "validation_split": 0.8}, "changes": "epoch_count 1 -> 10", "reasoning": "best individual epoch was 7 (0.1735) but final loss 0.1752 is worse than 5-epoch. LR may be too high for later epochs causing oscillation"}
{"experiment": 33, "commit": null, "quantile_loss": 0.1749, "status": "DISCARD", "description": "5 epochs + lr 0.002", "config": {"learning_rate": 0.002, "hidden_size": 64, "num_encoder_layers": 3, "num_decoder_layers": 2, "dropout_rate": 0.0, "batch_size": 16, "input_length": 35, "output_length": 7, "epoch_count": 5, "validation_split": 0.8}, "changes": "lr 0.003 -> 0.002 at 5 epochs", "reasoning": "marginal difference from lr=0.003 at 5 epochs"}
{"experiment": 34, "commit": null, "quantile_loss": 0.1611, "status": "DISCARD", "description": "5 epochs + lr 0.001", "config": {"learning_rate": 0.001, "hidden_size": 64, "num_encoder_layers": 3, "num_decoder_layers": 2, "dropout_rate": 0.0, "batch_size": 16, "input_length": 35, "output_length": 7, "epoch_count": 5, "validation_split": 0.8}, "changes": "lr 0.003 -> 0.001 at 5 epochs", "reasoning": "lower LR helps at 5 epochs, still improving through final epoch"}
{"experiment": 35, "commit": null, "quantile_loss": 0.0293, "status": "KEEP", "description": "10 epochs + lr 0.002 + dropout 0.05", "config": {"learning_rate": 0.002, "hidden_size": 64, "num_encoder_layers": 3, "num_decoder_layers": 2, "dropout_rate": 0.05, "batch_size": 16, "input_length": 35, "output_length": 7, "epoch_count": 10, "validation_split": 0.8}, "changes": "epoch_count 5 -> 10, lr 0.003 -> 0.002, dropout_rate 0.0 -> 0.05", "reasoning": "massive improvement. light dropout prevents overfitting at higher epoch count. loss still declining at epoch 10. total improvement from baseline: 89.1% (0.2684 -> 0.0293)"}
{"experiment": 36, "commit": null, "quantile_loss": 0.0911, "status": "DISCARD", "description": "10 epochs + lr 0.001 + batch 32", "config": {"learning_rate": 0.001, "hidden_size": 64, "num_encoder_layers": 3, "num_decoder_layers": 2, "dropout_rate": 0.0, "batch_size": 32, "input_length": 35, "output_length": 7, "epoch_count": 10, "validation_split": 0.8}, "changes": "epoch_count 5 -> 10, lr 0.003 -> 0.001, batch 16 -> 32", "reasoning": "strong improvement but batch=16 + dropout=0.05 + lr=0.002 is far better"}
{"experiment": 37, "commit": null, "quantile_loss": 0.1258, "status": "DISCARD", "description": "20 epochs, lr 0.002, dropout 0.05", "config": {"learning_rate": 0.002, "hidden_size": 64, "num_encoder_layers": 3, "num_decoder_layers": 2, "dropout_rate": 0.05, "batch_size": 16, "input_length": 35, "output_length": 7, "epoch_count": 20, "validation_split": 0.8}, "changes": "epoch_count 10 -> 20", "reasoning": "oscillation after epoch 6, early stopped. no checkpointing means final loss is worse than best epoch"}
{"experiment": 38, "commit": null, "quantile_loss": 0.1709, "status": "DISCARD", "description": "30 epochs, lr 0.002, dropout 0.05", "config": {"learning_rate": 0.002, "hidden_size": 64, "num_encoder_layers": 3, "num_decoder_layers": 2, "dropout_rate": 0.05, "batch_size": 16, "input_length": 35, "output_length": 7, "epoch_count": 30, "validation_split": 0.8}, "changes": "epoch_count 10 -> 30", "reasoning": "worse than 20 epochs, more oscillation"}
{"experiment": 39, "commit": null, "quantile_loss": 0.1256, "status": "DISCARD", "description": "20 epochs, lr 0.001, dropout 0.05", "config": {"learning_rate": 0.001, "hidden_size": 64, "num_encoder_layers": 3, "num_decoder_layers": 2, "dropout_rate": 0.05, "batch_size": 16, "input_length": 35, "output_length": 7, "epoch_count": 20, "validation_split": 0.8}, "changes": "epoch_count 10 -> 20, lr 0.002 -> 0.001", "reasoning": "reached 0.0138 at epoch 18 but spiked to 0.1256 at epoch 20. no checkpointing, final loss is what counts. lower LR needs more investigation"}
{"experiment": 40, "commit": null, "quantile_loss": 0.1099, "status": "DISCARD", "description": "20 epochs, lr 0.002, dropout 0.1", "config": {"learning_rate": 0.002, "hidden_size": 64, "num_encoder_layers": 3, "num_decoder_layers": 2, "dropout_rate": 0.1, "batch_size": 16, "input_length": 35, "output_length": 7, "epoch_count": 20, "validation_split": 0.8}, "changes": "epoch_count 10 -> 20, dropout 0.05 -> 0.1", "reasoning": "more dropout helps stabilize but still early stopped"}
