{"experiment": 41, "commit": null, "quantile_loss": 0.0377, "status": "DISCARD", "description": "15 epochs, lr 0.001", "config": {"learning_rate": 0.001, "hidden_size": 64, "num_encoder_layers": 3, "num_decoder_layers": 2, "dropout_rate": 0.05, "batch_size": 16, "input_length": 35, "output_length": 7, "epoch_count": 15, "validation_split": 0.8}, "changes": "epoch_count 10 -> 15, lr 0.002 -> 0.001", "reasoning": "loss not monotonically decreasing, some oscillation in later epochs"}
{"experiment": 42, "commit": null, "quantile_loss": 0.0298, "status": "DISCARD", "description": "20 epochs, lr 0.0005", "config": {"learning_rate": 0.0005, "hidden_size": 64, "num_encoder_layers": 3, "num_decoder_layers": 2, "dropout_rate": 0.05, "batch_size": 16, "input_length": 35, "output_length": 7, "epoch_count": 20, "validation_split": 0.8}, "changes": "epoch_count 10 -> 20, lr 0.002 -> 0.0005", "reasoning": "very low LR with many epochs, early stopped. marginal vs experiment 35"}
{"experiment": 43, "commit": null, "quantile_loss": 0.0237, "status": "DISCARD", "description": "15 epochs, lr 0.0005", "config": {"learning_rate": 0.0005, "hidden_size": 64, "num_encoder_layers": 3, "num_decoder_layers": 2, "dropout_rate": 0.05, "batch_size": 16, "input_length": 35, "output_length": 7, "epoch_count": 15, "validation_split": 0.8}, "changes": "epoch_count 10 -> 15, lr 0.002 -> 0.0005", "reasoning": "stable convergence curve but not as good as 10ep+lr=0.001"}
{"experiment": 44, "commit": null, "quantile_loss": 0.0206, "status": "KEEP", "description": "10 epochs, lr 0.001", "config": {"learning_rate": 0.001, "hidden_size": 64, "num_encoder_layers": 3, "num_decoder_layers": 2, "dropout_rate": 0.05, "batch_size": 16, "input_length": 35, "output_length": 7, "epoch_count": 10, "validation_split": 0.8}, "changes": "lr 0.002 -> 0.001 at 10 epochs", "reasoning": "lower LR gives more stable convergence over 10 epochs. new best at 0.0206, 92.3% improvement from baseline (0.2684)"}
{"experiment": 45, "commit": null, "quantile_loss": 0.0212, "status": "DISCARD", "description": "12 epochs, lr 0.001", "config": {"learning_rate": 0.001, "hidden_size": 64, "num_encoder_layers": 3, "num_decoder_layers": 2, "dropout_rate": 0.05, "batch_size": 16, "input_length": 35, "output_length": 7, "epoch_count": 12, "validation_split": 0.8}, "changes": "epoch_count 10 -> 12 at lr=0.001", "reasoning": "marginal difference, 10 epochs is sufficient at lr=0.001"}
{"experiment": 46, "commit": null, "quantile_loss": 0.1073, "status": "DISCARD", "description": "10 epochs, lr 0.0008", "config": {"learning_rate": 0.0008, "hidden_size": 64, "num_encoder_layers": 3, "num_decoder_layers": 2, "dropout_rate": 0.05, "batch_size": 16, "input_length": 35, "output_length": 7, "epoch_count": 10, "validation_split": 0.8}, "changes": "lr 0.001 -> 0.0008 at 10 epochs", "reasoning": "too slow to converge in 10 epochs"}
{"experiment": 47, "commit": null, "quantile_loss": 0.0516, "status": "DISCARD", "description": "15 epochs, lr 0.0008", "config": {"learning_rate": 0.0008, "hidden_size": 64, "num_encoder_layers": 3, "num_decoder_layers": 2, "dropout_rate": 0.05, "batch_size": 16, "input_length": 35, "output_length": 7, "epoch_count": 15, "validation_split": 0.8}, "changes": "epoch_count 10 -> 15, lr 0.001 -> 0.0008", "reasoning": "more epochs with lower LR, but still slower than lr=0.001+10ep"}
{"experiment": 48, "commit": null, "quantile_loss": 0.0330, "status": "DISCARD", "description": "12 epochs, lr 0.0005", "config": {"learning_rate": 0.0005, "hidden_size": 64, "num_encoder_layers": 3, "num_decoder_layers": 2, "dropout_rate": 0.05, "batch_size": 16, "input_length": 35, "output_length": 7, "epoch_count": 12, "validation_split": 0.8}, "changes": "epoch_count 10 -> 12, lr 0.001 -> 0.0005", "reasoning": "too slow to converge even with extra epochs"}
{"experiment": 49, "commit": "c4386d9", "quantile_loss": 0.1784, "status": "DISCARD", "description": "global skip connection from feature projection", "config": {"learning_rate": 0.001, "hidden_size": 64, "num_encoder_layers": 3, "num_decoder_layers": 2, "dropout_rate": 0.05, "batch_size": 16, "input_length": 35, "output_length": 7, "epoch_count": 10, "validation_split": 0.8}, "changes": "added feature_output skip connection bypassing encoder+decoder", "reasoning": "too strong shortcut prevents encoder-decoder learning"}
{"experiment": 50, "commit": "d0bd455", "quantile_loss": 0.0324, "status": "DISCARD", "description": "revert to single feature projection", "config": {"learning_rate": 0.001, "hidden_size": 64, "num_encoder_layers": 3, "num_decoder_layers": 2, "dropout_rate": 0.05, "batch_size": 16, "input_length": 35, "output_length": 7, "epoch_count": 10, "validation_split": 0.8}, "changes": "single feature_projection Linear(input, hidden) instead of two-stage", "reasoning": "two-stage (0.0206) is better than single (0.0324), confirming experiment 28"}
{"experiment": 51, "commit": "2ba21ca", "quantile_loss": 0.0528, "status": "DISCARD", "description": "replace relu with gelu throughout", "config": {"learning_rate": 0.001, "hidden_size": 64, "num_encoder_layers": 3, "num_decoder_layers": 2, "dropout_rate": 0.05, "batch_size": 16, "input_length": 35, "output_length": 7, "epoch_count": 10, "validation_split": 0.8}, "changes": "all relu -> gelu activation", "reasoning": "gelu converges slower than relu at this lr/epoch setting"}
{"experiment": 52, "commit": "9180b14", "quantile_loss": 0.0429, "status": "DISCARD", "description": "widen feature projection to 4x hidden", "config": {"learning_rate": 0.001, "hidden_size": 64, "num_encoder_layers": 3, "num_decoder_layers": 2, "dropout_rate": 0.05, "batch_size": 16, "input_length": 35, "output_length": 7, "epoch_count": 10, "validation_split": 0.8}, "changes": "feature_projection intermediate size 2*hidden -> 4*hidden (128 -> 256)", "reasoning": "wider projection converges slower, no benefit over 2x"}
{"experiment": 53, "commit": "3e79386", "quantile_loss": 0.0163, "status": "KEEP", "description": "20 epochs, lr 0.001, dropout 0.05 (with checkpointing fix)", "config": {"learning_rate": 0.001, "hidden_size": 64, "num_encoder_layers": 3, "num_decoder_layers": 2, "dropout_rate": 0.05, "batch_size": 16, "input_length": 35, "output_length": 7, "epoch_count": 20, "validation_split": 0.8}, "changes": "epoch_count 10 -> 20, fixed reporting to use best-epoch loss via checkpointing", "reasoning": "checkpointing fix unlocks multi-epoch training. best loss 0.0163 at epoch 16, final epoch 0.14 due to oscillation. 21% improvement over previous best (0.0206)"}
{"experiment": 54, "commit": null, "quantile_loss": 0.0720, "status": "DISCARD", "description": "15 epochs, lr 0.001, dropout 0.05", "config": {"learning_rate": 0.001, "hidden_size": 64, "num_encoder_layers": 3, "num_decoder_layers": 2, "dropout_rate": 0.05, "batch_size": 16, "input_length": 35, "output_length": 7, "epoch_count": 15, "validation_split": 0.8}, "changes": "epoch_count 10 -> 15", "reasoning": "early stopped at epoch 9, not enough training depth"}
{"experiment": 55, "commit": null, "quantile_loss": 0.0224, "status": "DISCARD", "description": "20 epochs, lr 0.0005, dropout 0.05", "config": {"learning_rate": 0.0005, "hidden_size": 64, "num_encoder_layers": 3, "num_decoder_layers": 2, "dropout_rate": 0.05, "batch_size": 16, "input_length": 35, "output_length": 7, "epoch_count": 20, "validation_split": 0.8}, "changes": "epoch_count 10 -> 20, lr 0.001 -> 0.0005", "reasoning": "stable convergence but too slow, lr=0.001 with checkpointing is better"}
{"experiment": 56, "commit": null, "quantile_loss": 0.0286, "status": "DISCARD", "description": "10 epochs baseline re-check", "config": {"learning_rate": 0.001, "hidden_size": 64, "num_encoder_layers": 3, "num_decoder_layers": 2, "dropout_rate": 0.05, "batch_size": 16, "input_length": 35, "output_length": 7, "epoch_count": 10, "validation_split": 0.8}, "changes": "baseline re-check with new reporting", "reasoning": "stochastic variance, 10 epochs not enough depth compared to 20"}
{"experiment": 57, "commit": null, "quantile_loss": 0.0145, "status": "DISCARD", "description": "20 epochs, lr 0.0015, dropout 0.05", "config": {"learning_rate": 0.0015, "hidden_size": 64, "num_encoder_layers": 3, "num_decoder_layers": 2, "dropout_rate": 0.05, "batch_size": 16, "input_length": 35, "output_length": 7, "epoch_count": 20, "validation_split": 0.8}, "changes": "lr 0.001 -> 0.0015 at 20 epochs", "reasoning": "good improvement but beaten by dropout=0.1 variant"}
{"experiment": 58, "commit": null, "quantile_loss": 0.0134, "status": "KEEP", "description": "20 epochs, lr 0.001, dropout 0.1", "config": {"learning_rate": 0.001, "hidden_size": 64, "num_encoder_layers": 3, "num_decoder_layers": 2, "dropout_rate": 0.1, "batch_size": 16, "input_length": 35, "output_length": 7, "epoch_count": 20, "validation_split": 0.8}, "changes": "dropout 0.05 -> 0.1 at 20 epochs", "reasoning": "higher dropout stabilizes training at 20 epochs. final loss (0.0136) nearly equal to best (0.0134), very stable convergence. 95% improvement from original baseline"}
{"experiment": 59, "commit": null, "quantile_loss": 0.0188, "status": "DISCARD", "description": "20 epochs, lr 0.001, dropout 0.02", "config": {"learning_rate": 0.001, "hidden_size": 64, "num_encoder_layers": 3, "num_decoder_layers": 2, "dropout_rate": 0.02, "batch_size": 16, "input_length": 35, "output_length": 7, "epoch_count": 20, "validation_split": 0.8}, "changes": "dropout 0.05 -> 0.02 at 20 epochs", "reasoning": "too little regularization, more oscillation"}
{"experiment": 60, "commit": null, "quantile_loss": 0.0140, "status": "DISCARD", "description": "30 epochs, lr 0.001, dropout 0.05", "config": {"learning_rate": 0.001, "hidden_size": 64, "num_encoder_layers": 3, "num_decoder_layers": 2, "dropout_rate": 0.05, "batch_size": 16, "input_length": 35, "output_length": 7, "epoch_count": 30, "validation_split": 0.8}, "changes": "epoch_count 20 -> 30 at lr=0.001, dropout=0.05", "reasoning": "very stable convergence at 30 epochs, close to exp 58 but dropout=0.1 at 20 epochs is slightly better"}
{"experiment": 61, "commit": null, "quantile_loss": 0.01254, "status": "KEEP", "description": "30 epochs, lr 0.001, dropout 0.1, patience 5", "config": {"learning_rate": 0.001, "hidden_size": 64, "num_encoder_layers": 3, "num_decoder_layers": 2, "dropout_rate": 0.1, "batch_size": 16, "input_length": 35, "output_length": 7, "epoch_count": 30, "early_stopping_patience": 5, "validation_split": 0.8}, "changes": "epoch_count 20 -> 30, early_stopping_patience 3 -> 5", "reasoning": "dropout 0.1 stabilizes longer training. steady convergence through epoch 25 (0.0137 -> 0.01254). 6.4% improvement over previous best (0.0134)"}
{"experiment": 62, "commit": null, "quantile_loss": 0.0549, "status": "DISCARD", "description": "40 epochs, lr 0.001, dropout 0.1, patience 5", "config": {"learning_rate": 0.001, "hidden_size": 64, "num_encoder_layers": 3, "num_decoder_layers": 2, "dropout_rate": 0.1, "batch_size": 16, "input_length": 35, "output_length": 7, "epoch_count": 40, "early_stopping_patience": 5, "validation_split": 0.8}, "changes": "epoch_count 20 -> 40, patience 5", "reasoning": "early stopped at epoch 16, stochastic run didn't converge as well"}
{"experiment": 63, "commit": null, "quantile_loss": 0.0185, "status": "DISCARD", "description": "hidden 128, 20 epochs, dropout 0.1", "config": {"learning_rate": 0.001, "hidden_size": 128, "num_encoder_layers": 3, "num_decoder_layers": 2, "dropout_rate": 0.1, "batch_size": 16, "input_length": 35, "output_length": 7, "epoch_count": 20, "early_stopping_patience": 3, "validation_split": 0.8}, "changes": "hidden_size 64 -> 128", "reasoning": "larger model converges slower, no benefit at 20 epochs with this data size"}
{"experiment": 64, "commit": null, "quantile_loss": 0.0165, "status": "DISCARD", "description": "batch_size 32, 20 epochs, dropout 0.1", "config": {"learning_rate": 0.001, "hidden_size": 64, "num_encoder_layers": 3, "num_decoder_layers": 2, "dropout_rate": 0.1, "batch_size": 32, "input_length": 35, "output_length": 7, "epoch_count": 20, "early_stopping_patience": 3, "validation_split": 0.8}, "changes": "batch_size 16 -> 32", "reasoning": "smoother convergence (final=best) but fewer gradient updates per epoch, slightly worse than batch 16"}
